{
  "version": 1,
  "source": "embedded_fallback",
  "models": {
    "claude-3-5-sonnet-20241022": {
      "id": "claude-3-5-sonnet-20241022",
      "owned_by": "anthropic",
      "capabilities": [
        "chat",
        "tools"
      ],
      "bindings": {
        "claude": {
          "provider_id": "claude",
          "policy": "closed",
          "source": "embedded_fallback",
          "capabilities": [
            "chat",
            "tools"
          ],
          "authority": {
            "models": true,
            "capabilities": true,
            "aliases": true,
            "prefixes": true,
            "upstream_id": true
          },
          "priority": 100
        }
      },
      "aliases": [],
      "metadata": {
        "context_limit": "200000"
      }
    },
    "claude-3-7-sonnet-20250219": {
      "id": "claude-3-7-sonnet-20250219",
      "owned_by": "anthropic",
      "capabilities": [
        "chat",
        "tools"
      ],
      "bindings": {
        "claude": {
          "provider_id": "claude",
          "policy": "closed",
          "source": "embedded_fallback",
          "capabilities": [
            "chat",
            "tools"
          ],
          "authority": {
            "models": true,
            "capabilities": true,
            "aliases": true,
            "prefixes": true,
            "upstream_id": true
          },
          "priority": 100
        }
      },
      "aliases": [],
      "metadata": {
        "context_limit": "200000"
      }
    },
    "claude-haiku-4-5": {
      "id": "claude-haiku-4-5",
      "owned_by": "anthropic",
      "capabilities": [
        "chat",
        "tools"
      ],
      "bindings": {
        "claude": {
          "provider_id": "claude",
          "policy": "closed",
          "source": "embedded_fallback",
          "capabilities": [
            "chat",
            "tools"
          ],
          "authority": {
            "models": true,
            "capabilities": true,
            "aliases": true,
            "prefixes": true,
            "upstream_id": true
          },
          "priority": 100
        }
      },
      "aliases": [],
      "metadata": {
        "context_limit": "200000"
      }
    },
    "claude-haiku-4-5-20251001": {
      "id": "claude-haiku-4-5-20251001",
      "owned_by": "anthropic",
      "capabilities": [
        "chat",
        "tools"
      ],
      "bindings": {
        "claude": {
          "provider_id": "claude",
          "policy": "closed",
          "source": "embedded_fallback",
          "capabilities": [
            "chat",
            "tools"
          ],
          "authority": {
            "models": true,
            "capabilities": true,
            "aliases": true,
            "prefixes": true,
            "upstream_id": true
          },
          "priority": 100
        }
      },
      "aliases": [],
      "metadata": {
        "context_limit": "200000"
      }
    },
    "claude-opus-4-5": {
      "id": "claude-opus-4-5",
      "owned_by": "anthropic",
      "capabilities": [
        "chat",
        "tools"
      ],
      "bindings": {
        "claude": {
          "provider_id": "claude",
          "policy": "closed",
          "source": "embedded_fallback",
          "capabilities": [
            "chat",
            "tools"
          ],
          "authority": {
            "models": true,
            "capabilities": true,
            "aliases": true,
            "prefixes": true,
            "upstream_id": true
          },
          "priority": 100
        }
      },
      "aliases": [],
      "metadata": {
        "context_limit": "200000"
      }
    },
    "claude-opus-4-5-20251101": {
      "id": "claude-opus-4-5-20251101",
      "owned_by": "anthropic",
      "capabilities": [
        "chat",
        "tools"
      ],
      "bindings": {
        "claude": {
          "provider_id": "claude",
          "policy": "closed",
          "source": "embedded_fallback",
          "capabilities": [
            "chat",
            "tools"
          ],
          "authority": {
            "models": true,
            "capabilities": true,
            "aliases": true,
            "prefixes": true,
            "upstream_id": true
          },
          "priority": 100
        }
      },
      "aliases": [],
      "metadata": {
        "context_limit": "200000"
      }
    },
    "claude-opus-4-5-20251101-thinking": {
      "id": "claude-opus-4-5-20251101-thinking",
      "owned_by": "anthropic",
      "capabilities": [
        "chat",
        "tools"
      ],
      "bindings": {
        "claude": {
          "provider_id": "claude",
          "policy": "closed",
          "source": "embedded_fallback",
          "capabilities": [
            "chat",
            "tools"
          ],
          "authority": {
            "models": true,
            "capabilities": true,
            "aliases": true,
            "prefixes": true,
            "upstream_id": true
          },
          "priority": 100
        }
      },
      "aliases": [],
      "metadata": {
        "context_limit": "200000"
      }
    },
    "claude-opus-4-6": {
      "id": "claude-opus-4-6",
      "owned_by": "anthropic",
      "capabilities": [
        "chat",
        "tools"
      ],
      "bindings": {
        "claude": {
          "provider_id": "claude",
          "policy": "closed",
          "source": "embedded_fallback",
          "capabilities": [
            "chat",
            "tools"
          ],
          "authority": {
            "models": true,
            "capabilities": true,
            "aliases": true,
            "prefixes": true,
            "upstream_id": true
          },
          "priority": 100
        }
      },
      "aliases": [],
      "metadata": {
        "context_limit": "1000000"
      }
    },
    "claude-opus-4-6-thinking": {
      "id": "claude-opus-4-6-thinking",
      "owned_by": "google",
      "capabilities": [
        "chat",
        "tools"
      ],
      "bindings": {
        "antigravity": {
          "provider_id": "antigravity",
          "policy": "closed",
          "source": "embedded_fallback",
          "capabilities": [
            "chat",
            "tools"
          ],
          "authority": {
            "models": true,
            "capabilities": true,
            "aliases": true,
            "prefixes": true,
            "upstream_id": true
          },
          "priority": 100
        }
      },
      "aliases": [],
      "metadata": {
        "context_limit": "250000"
      }
    },
    "claude-sonnet-4-5": {
      "id": "claude-sonnet-4-5",
      "owned_by": "anthropic",
      "capabilities": [
        "chat",
        "tools"
      ],
      "bindings": {
        "claude": {
          "provider_id": "claude",
          "policy": "closed",
          "source": "embedded_fallback",
          "capabilities": [
            "chat",
            "tools"
          ],
          "authority": {
            "models": true,
            "capabilities": true,
            "aliases": true,
            "prefixes": true,
            "upstream_id": true
          },
          "priority": 100
        }
      },
      "aliases": [],
      "metadata": {
        "context_limit": "1000000"
      }
    },
    "claude-sonnet-4-5-20250929": {
      "id": "claude-sonnet-4-5-20250929",
      "owned_by": "anthropic",
      "capabilities": [
        "chat",
        "tools"
      ],
      "bindings": {
        "claude": {
          "provider_id": "claude",
          "policy": "closed",
          "source": "embedded_fallback",
          "capabilities": [
            "chat",
            "tools"
          ],
          "authority": {
            "models": true,
            "capabilities": true,
            "aliases": true,
            "prefixes": true,
            "upstream_id": true
          },
          "priority": 100
        }
      },
      "aliases": [],
      "metadata": {
        "context_limit": "1000000"
      }
    },
    "claude-sonnet-4-5-20250929-thinking": {
      "id": "claude-sonnet-4-5-20250929-thinking",
      "owned_by": "anthropic",
      "capabilities": [
        "chat",
        "tools"
      ],
      "bindings": {
        "claude": {
          "provider_id": "claude",
          "policy": "closed",
          "source": "embedded_fallback",
          "capabilities": [
            "chat",
            "tools"
          ],
          "authority": {
            "models": true,
            "capabilities": true,
            "aliases": true,
            "prefixes": true,
            "upstream_id": true
          },
          "priority": 100
        }
      },
      "aliases": [],
      "metadata": {
        "context_limit": "1000000"
      }
    },
    "claude-sonnet-4-6": {
      "id": "claude-sonnet-4-6",
      "owned_by": "google",
      "capabilities": [
        "chat",
        "tools"
      ],
      "bindings": {
        "antigravity": {
          "provider_id": "antigravity",
          "policy": "closed",
          "source": "embedded_fallback",
          "capabilities": [
            "chat",
            "tools"
          ],
          "authority": {
            "models": true,
            "capabilities": true,
            "aliases": true,
            "prefixes": true,
            "upstream_id": true
          },
          "priority": 100
        },
        "claude": {
          "provider_id": "claude",
          "policy": "closed",
          "source": "embedded_fallback",
          "capabilities": [
            "chat",
            "tools"
          ],
          "authority": {
            "models": true,
            "capabilities": true,
            "aliases": true,
            "prefixes": true,
            "upstream_id": true
          },
          "priority": 90
        }
      },
      "aliases": [],
      "metadata": {
        "context_limit": "1000000"
      }
    },
    "cursor-fast": {
      "id": "cursor-fast",
      "owned_by": "cursor",
      "capabilities": [